<?xml version="1.0" encoding="UTF-8"?>
<database xmlns:xsi="http://www.w3.org/2001/XMLSchema-instance"
    xsi:noNamespaceSchemaLocation="Database.xsd">
    <Concours>
        <Concour ID_Concours="1">
            <NomConcours>Programming Competition</NomConcours>
            <DateConcours>2023-01-01</DateConcours>
            <LieuConcours>Virtual</LieuConcours>
        </Concour>

        <Concour ID_Concours="2">
            <NomConcours>Math Olympiad</NomConcours>
            <DateConcours>2023-02-15</DateConcours>
            <LieuConcours>In-person</LieuConcours>
        </Concour>

        <Concour ID_Concours="3">
            <NomConcours>Science Fair</NomConcours>
            <DateConcours>2023-03-10</DateConcours>
            <LieuConcours>Hybrid</LieuConcours>
        </Concour>


    </Concours>


    <Specialites>
        <Specialite ID_Specialite="1">
            <libelle>Computer Science</libelle>
        </Specialite>
        <Specialite ID_Specialite="2">
            <libelle>Electrical Engineering</libelle>
        </Specialite>

        <Specialite ID_Specialite="3">
            <libelle>Mechanical Engineering</libelle>
        </Specialite>
    </Specialites>

    <Diplomes>
        <Diplome ID_Diplome="1" ID_Specialite="1" ID_Candidat="1">
            <AnneeObtention>2022</AnneeObtention>
        </Diplome>

        <Diplome ID_Diplome="2" ID_Specialite="2" ID_Candidat="2">
            <AnneeObtention>2023</AnneeObtention>
        </Diplome>

        <Diplome ID_Diplome="3" ID_Specialite="3" ID_Candidat="3">
            <AnneeObtention>2021</AnneeObtention>
        </Diplome>
    </Diplomes>

    <Candidats>
        <Candidat ID_Candidat="1" cin="123456789" cne="987654321">
            <Nom>John</Nom>
            <Prenom>Doe</Prenom>
            <email>john.doe@example.com</email>
            <password>securepassword</password>
            <telephone>1234567890</telephone>
            <DateNaissance>1990-01-01</DateNaissance>
        </Candidat>

        <Candidat ID_Candidat="2" cin="987654321" cne="123456789">
            <Nom>Jane</Nom>
            <Prenom>Smith</Prenom>
            <email>jane.smith@example.com</email>
            <password>anotherpassword</password>
            <telephone>9876543210</telephone>
            <DateNaissance>1988-05-15</DateNaissance>
        </Candidat>

        <Candidat ID_Candidat="3" cin="555555555" cne="111111111">
            <Nom>Alice</Nom>
            <Prenom>Johnson</Prenom>
            <email>alice.johnson@example.com</email>
            <password>securepassword123</password>
            <telephone>5555555555</telephone>
            <DateNaissance>1995-08-20</DateNaissance>
        </Candidat>
    </Candidats>
    <Candidatures>
        <Candidature ID_Candidature="1" ID_Candidat="1">
            <Date_Candidature>2023-01-15</Date_Candidature>
        </Candidature>

        <Candidature ID_Candidature="2" ID_Candidat="2">
            <Date_Candidature>2023-02-28</Date_Candidature>
        </Candidature>

        <Candidature ID_Candidature="3" ID_Candidat="3">
            <Date_Candidature>2023-03-20</Date_Candidature>
        </Candidature>
    </Candidatures>

    <Choixs>
        <Choix ID_Candidature="1" ID_Concours="1">
            <Priorite>1</Priorite>
        </Choix>
        <Choix ID_Candidature="1" ID_Concours="2">
            <Priorite>2</Priorite>
        </Choix>

        <Choix ID_Candidature="1" ID_Concours="3">
            <Priorite>3</Priorite>
        </Choix>
        <Choix ID_Candidature="3" ID_Concours="2">
            <Priorite>2</Priorite>
        </Choix>
    </Choixs>
</database>